{
  "descricao": "Interpretacao do teor de potassio no solo (Mehlich-1) por grupo de exigencia da cultura e faixa de CTC pH 7,0",
  "fonte": {
    "manual": "CQFS-RS/SC, Manual de Calagem e Adubacao para os estados do RS e de SC, 11. ed., 2016",
    "tabelas": [
      "6.7",
      "6.8",
      "6.9",
      "6.10"
    ],
    "paginas": [
      95,
      95,
      96,
      96
    ],
    "extraido_do_pdf_em": "2026-08-17",
    "conferido_por_autor_em": "2026-08-22",
    "aviso_operadores": "Operadores >= e <= extraidos como '=' pelo PDF e reconstruidos por contexto. CONFERIR na pagina renderizada antes de preencher conferido_por_autor_em."
  },
  "unidade": "mg de K/dm3",
  "metodo": "Mehlich-1",
  "conversao_mehlich3": {
    "formula": "K_M1 = K_M3 * 0,83",
    "fonte": "Capitulo 4"
  },
  "depende_de": "faixa_ctc_ph7",
  "faixas_ctc": [
    {
      "faixa": "a",
      "de": null,
      "ate": 7.5
    },
    {
      "faixa": "b",
      "de": 7.5,
      "ate": 15.0
    },
    {
      "faixa": "c",
      "de": 15.0,
      "ate": 30.0
    },
    {
      "faixa": "d",
      "de": 30.0,
      "ate": null
    }
  ],
  "grupos_exigencia": [
    {
      "grupo": "grupo_1",
      "descricao": "muito exigentes (1,5x graos)",
      "tabela": "6.8",
      "culturas": [
        "alho",
        "beterraba",
        "cenoura",
        "mandioquinha-salsa",
        "tomate",
        "batata",
        "batata-doce",
        "roseira-de-corte"
      ]
    },
    {
      "grupo": "grupo_2",
      "descricao": "exigentes (igual graos)",
      "tabela": "6.9",
      "culturas_texto": "culturas de graos; pastagens exceto pastagem natural; frutiferas; mandioca; hortalicas exceto Grupo 1",
      "culturas": [
        "mandioca",
        "alfafa"
      ],
      "culturas_fonte": "Manual RS/SC 2016, Anexo 2 (p. 361-366) - transcricao parcial, conferida pelo autor em 2026-09-07; alfafa acrescentada em 2026-09-10. Mandioca diverge de P (grupo_p=3, grupo_k=2) - ver interpretacao_p.json. Alfafa (Medicago sativa, secao FORRAGEIRAS) e 2 nos dois eixos."
    },
    {
      "grupo": "grupo_3",
      "descricao": "pouco exigentes (0,7x graos)",
      "tabela": "6.10",
      "culturas_texto": "demais culturas nao inclusas nos Grupos 1 e 2",
      "culturas": [
        "acácia-negra",
        "araucária",
        "bracatinga",
        "cedro-australiano",
        "erva-mate",
        "eucalipto",
        "pinus",
        "pastagem-natural",
        "gengibre"
      ],
      "culturas_fonte": "Manual RS/SC 2016, Anexo 2 (p. 361-366) - transcricao parcial, conferida pelo autor em 2026-09-07; gengibre acrescentado em 2026-09-10. Gengibre (Zingiber officinale, secao MEDICINAIS) e grupo_p=2 e grupo_k=3: a Tab. 6.2 o nomeia no Grupo 2 de P, a Tab. 6.7 nao o inclui nos Grupos 1 nem 2 de K.",
      "culturas_pendente": "Anexo 2 tem ~150 culturas; so as listadas acima (as sem pH de referencia da Tabela 5.1) foram conferidas ate agora. 'culturas_texto' continua sendo so descricao, nao lista exaustiva - grupo_exigencia() so resolve pelas 'culturas' explicitas ou pelo fallback de graos."
    }
  ],
  "tabelas": [
    {
      "grupo": "grupo_1",
      "fonte": "Tabela 6.8, p. 95",
      "por_faixa_ctc": [
        {
          "faixa_ctc": "a",
          "faixas": [
            {
              "classe": "muito_baixo",
              "de": null,
              "ate": 30
            },
            {
              "classe": "baixo",
              "de": 30,
              "ate": 60
            },
            {
              "classe": "medio",
              "de": 60,
              "ate": 90
            },
            {
              "classe": "alto",
              "de": 90,
              "ate": 180
            },
            {
              "classe": "muito_alto",
              "de": 180,
              "ate": null
            }
          ]
        },
        {
          "faixa_ctc": "b",
          "faixas": [
            {
              "classe": "muito_baixo",
              "de": null,
              "ate": 45
            },
            {
              "classe": "baixo",
              "de": 45,
              "ate": 90
            },
            {
              "classe": "medio",
              "de": 90,
              "ate": 135
            },
            {
              "classe": "alto",
              "de": 135,
              "ate": 270
            },
            {
              "classe": "muito_alto",
              "de": 270,
              "ate": null
            }
          ]
        },
        {
          "faixa_ctc": "c",
          "faixas": [
            {
              "classe": "muito_baixo",
              "de": null,
              "ate": 60
            },
            {
              "classe": "baixo",
              "de": 60,
              "ate": 120
            },
            {
              "classe": "medio",
              "de": 120,
              "ate": 180
            },
            {
              "classe": "alto",
              "de": 180,
              "ate": 360
            },
            {
              "classe": "muito_alto",
              "de": 360,
              "ate": null
            }
          ]
        },
        {
          "faixa_ctc": "d",
          "faixas": [
            {
              "classe": "muito_baixo",
              "de": null,
              "ate": 70
            },
            {
              "classe": "baixo",
              "de": 70,
              "ate": 140
            },
            {
              "classe": "medio",
              "de": 140,
              "ate": 210
            },
            {
              "classe": "alto",
              "de": 210,
              "ate": 420
            },
            {
              "classe": "muito_alto",
              "de": 420,
              "ate": null
            }
          ]
        }
      ]
    },
    {
      "grupo": "grupo_2",
      "fonte": "Tabela 6.9, p. 96",
      "por_faixa_ctc": [
        {
          "faixa_ctc": "a",
          "faixas": [
            {
              "classe": "muito_baixo",
              "de": null,
              "ate": 20
            },
            {
              "classe": "baixo",
              "de": 20,
              "ate": 40
            },
            {
              "classe": "medio",
              "de": 40,
              "ate": 60
            },
            {
              "classe": "alto",
              "de": 60,
              "ate": 120
            },
            {
              "classe": "muito_alto",
              "de": 120,
              "ate": null
            }
          ]
        },
        {
          "faixa_ctc": "b",
          "faixas": [
            {
              "classe": "muito_baixo",
              "de": null,
              "ate": 30
            },
            {
              "classe": "baixo",
              "de": 30,
              "ate": 60
            },
            {
              "classe": "medio",
              "de": 60,
              "ate": 90
            },
            {
              "classe": "alto",
              "de": 90,
              "ate": 180
            },
            {
              "classe": "muito_alto",
              "de": 180,
              "ate": null
            }
          ]
        },
        {
          "faixa_ctc": "c",
          "faixas": [
            {
              "classe": "muito_baixo",
              "de": null,
              "ate": 40
            },
            {
              "classe": "baixo",
              "de": 40,
              "ate": 80
            },
            {
              "classe": "medio",
              "de": 80,
              "ate": 120
            },
            {
              "classe": "alto",
              "de": 120,
              "ate": 240
            },
            {
              "classe": "muito_alto",
              "de": 240,
              "ate": null
            }
          ]
        },
        {
          "faixa_ctc": "d",
          "faixas": [
            {
              "classe": "muito_baixo",
              "de": null,
              "ate": 45
            },
            {
              "classe": "baixo",
              "de": 45,
              "ate": 90
            },
            {
              "classe": "medio",
              "de": 90,
              "ate": 135
            },
            {
              "classe": "alto",
              "de": 135,
              "ate": 270
            },
            {
              "classe": "muito_alto",
              "de": 270,
              "ate": null
            }
          ]
        }
      ]
    },
    {
      "grupo": "grupo_3",
      "fonte": "Tabela 6.10, p. 96",
      "por_faixa_ctc": [
        {
          "faixa_ctc": "a",
          "faixas": [
            {
              "classe": "muito_baixo",
              "de": null,
              "ate": 15
            },
            {
              "classe": "baixo",
              "de": 15,
              "ate": 30
            },
            {
              "classe": "medio",
              "de": 30,
              "ate": 45
            },
            {
              "classe": "alto",
              "de": 45,
              "ate": 90
            },
            {
              "classe": "muito_alto",
              "de": 90,
              "ate": null
            }
          ]
        },
        {
          "faixa_ctc": "b",
          "faixas": [
            {
              "classe": "muito_baixo",
              "de": null,
              "ate": 20
            },
            {
              "classe": "baixo",
              "de": 20,
              "ate": 40
            },
            {
              "classe": "medio",
              "de": 40,
              "ate": 60
            },
            {
              "classe": "alto",
              "de": 60,
              "ate": 120
            },
            {
              "classe": "muito_alto",
              "de": 120,
              "ate": null
            }
          ]
        },
        {
          "faixa_ctc": "c",
          "faixas": [
            {